{"candidateArtifact":"benchmarks/model-outputs/fixed-1.0/hopf-degree-theorem-v3.26-20260818T095349Z.json","caseId":"hopf-degree-theorem","entries":{"completeness":18,"correctness":23,"score":41},"format":{"jsonValidity":4,"referenceIntegrity":6,"score":10},"goldRevision":"v1","incorrectEntries":["paper:def:winding：候选将方向映射的值域固定写成 S^1，未正确覆盖 Gold 中一般维数的方向球面定义。","paper:def:bump：候选给出了标准紧支撑光滑函数，但没有完整保留 Gold 所要求的在 B_{1/2} 上等于 1、在 B_1 外等于 0 的截断性质。","paper:lemma:base-s1：候选只提取了 degree=0 蕴含零伦，未完整陈述 S^1 自映射同伦当且仅当度相等以及标准代表 z↦z^n。","paper:lemma:punctured-euclidean：候选只保留零绕数蕴含零伦，缺少 Gold 的“当且仅当”及球盘延拓方向。","paper:b0:epsilon-nbhd：候选声称任意 ε 的邻域均具有最近点投影；Gold 只断言存在充分小的 ε，且候选遗漏投影的光滑性和向量丛局部平凡结构。","paper:lemma:vf-finite-zeros：候选只陈述存在某个有限零点向量场，没有完整保留给定向量场可经同伦扰动得到有限零点场的结论。","paper:cor:hairy-ball：候选仅陈述 S^2 情形，未覆盖 Gold 的所有偶数维球面以及奇数维球面的存在性对照。"],"incorrectInferences":["paper:inference:proof:4：其 premises 中的 zero-degree-inductive-step 条目只陈述正则值和局部坐标构造，并未陈述归纳步骤最终推出零伦；按候选自身 Entry 语义，这些 premises 不足以推出一般球面的零度判据。","paper:inference:proof:17：候选用 degree 的同伦不变性作为 Linear Isotopy Lemma 的证明前提，但该性质不能推出 GL(k,R) 两个行列式符号分支内的路径连通性；该推理方向不充分。","paper:inference:proof:18：只证明 S^1 上零度映射零伦，没有覆盖 Gold 基例中任意相同度映射同伦及 z↦z^n 标准代表的完整逻辑内容。","paper:inference:proof:5：只建立零绕数到零伦的方向，没有覆盖 Gold 穿孔空间判据的反向及延拓等价。"],"inferences":{"completeness":17,"correctness":23,"score":40},"matchedEntries":["paper:def:degree","paper:def:stereo","paper:def:bump（部分等价）","paper:calc:euler-sphere（球面部分）","paper:b0:isotopy","paper:b0:linear-isotopy","paper:b0:sard","paper:b0:transversality-extension","paper:b0:transversality-homotopy","paper:b0:epsilon-nbhd（部分匹配）","paper:b0:poincare-hopf","paper:lemma:regular-winding","paper:lemma:winding-sum","paper:lemma:boundary-extension","paper:lemma:base-s1（部分匹配）","paper:lemma:punctured-euclidean（单向部分）","paper:lemma:remove-origin","paper:thm:degree-zero-null","paper:thm:extension","paper:thm:hopf","paper:cor:homotopy-group","paper:lemma:vf-index-zero","paper:lemma:vf-finite-zeros（存在性部分）","paper:lemma:vf-localize（由候选的局部化和去零条目分布式覆盖）","paper:thm:vf-euler","paper:cor:hairy-ball（S^2 部分）"],"matchedInferences":["paper:proof:regular-winding","paper:proof:winding-sum","paper:proof:boundary-extension","paper:proof:remove-origin","paper:proof:degree-zero-null（由候选 proof:4、6、7、19 的归纳链覆盖）","paper:proof:extension（由候选 proof:8、9、10、20 覆盖）","paper:proof:hopf","paper:proof:vf-index-zero","paper:proof:vf-finite-zeros","paper:proof:vf-localize","paper:proof:vf-euler","paper:proof:hairy-ball"],"missingEntries":["paper:def:vf-index","paper:calc:euler-sphere 中 χ(T^n)=0 的环面计算","paper:lemma:extend-rk1：S^k→S^k 延拓为 D^{k+1}→S^k 当且仅当 degree=0 的精确陈述"],"missingInferences":["paper:proof:extend-rk1：候选的欧氏空间延拓构造与 Gold 结论的值域和充要条件不同，不能完整匹配。","paper:proof:homotopy-group：候选有 π_k(S^k)≅Z 的 Entry，但没有以 Hopf 度定理为 premise、该同伦群结论为 conclusion 的 inference。","paper:proof:base-s1 的相同度分类与标准代表部分","paper:proof:punctured-euclidean 的反向与球盘延拓部分"],"promptVersion":"sol-score-prompt-v2","schema":"cmath.paper-import-sol-score/v2","scorer":"gpt-5.6-sol","solScore":91,"summary":"候选 JSON 与 Project View 均可解析，mainTarget、B₀ 和全部 inference 引用有效。它正确覆盖了 Hopf 度定理、度零判据、扩张定理、主要归纳构造，以及 Poincaré–Hopf 到无零点向量场和毛球定理的核心链条；表示虽有合并和推广，但大多数学等价。主要缺陷是缺少向量场零点指标定义、环面的欧拉示性数和精确的 extend-rk1 条目，若干充要条件被缩成单向命题，毛球定理只保留 S^2，并且零度球面归纳链在候选 Entry/premise 层面存在一个显式语义缺口。","verdict":"mature"}