{"candidateArtifact":"benchmarks/model-outputs/fixed-1.0/cornered-skein-lasagna-theory-v3.26-20260818T100746Z.json","caseId":"cornered-skein-lasagna-theory","entries":{"completeness":18,"correctness":23,"score":41},"format":{"jsonValidity":4,"referenceIntegrity":5,"score":9},"goldRevision":"v1","incorrectEntries":["MWW24-Theorem-2.1：仅陈述链环不变量满足若干函子性条件，未完整表达 Gold 的 MWW Skein Lasagna 模基础理论及其作为论文基础的角色。","paper:theorem:fragmentation：与 Ban97-fragmentation-lemma 重复，并被候选作为论文自身 theorem 及 B₀ 项处理；Gold 明确将 Banyaga fragmentation lemma 视为外部背景而非本文定理。","paper:definition:surface-bicategory-module：公式中的控制字符使 \\mathcal C 和 \\mathsf{Cat} 记号损坏；该附加项虽不影响核心结论，但数学文本不完整。"],"incorrectInferences":["paper:inference:proof:7：对三截面 HH_0 组装公式加入 paper:theorem:self-gluing-closed 作为前提，并称需用封回关系恢复闭合空间；Gold 的结论只描述挖去中心曲面邻域后的模，所需逻辑是迭代双模粘合后作自粘合 HH_0，不需要闭流形填补定理。","paper:inference:proof:1 与 paper:inference:proof:9 对 Lemma 3.7 的证明内容有所重复；二者分别指向整体拼接同构和几何逆映射，但没有清楚表达后者只是前者证明中的组成步骤。"],"inferences":{"completeness":18,"correctness":23,"score":41},"matchedEntries":["paper:def:cornered-3mfld-category ≃ paper:definition:3-manifold-category","paper:def:cornered-4mfld-bimodule ≃ paper:def:cornered-bimodule","paper:def:bimodule-tensor-product","paper:def:hochschild-homology ≃ paper:definition:hh0","paper:def:trisection-diagram ≃ paper:definition:trisection + paper:definition:trisection-diagram","paper:def:surface-bicategory ≃ paper:definition:surface-bicategory","paper:b0:rw-gluing-map ≃ RW24-Proposition-2.3","paper:b0:banyaga-fragmentation ≃ Ban97-fragmentation-lemma","paper:lemma:gluing-isomorphism-eval ≃ paper:lemma:gluing","paper:thm:gluing-bimodules ≃ paper:theorem:gluing；mainTarget 角色正确","paper:lemma:self-gluing-eval ≃ paper:lemma:self-gluing-identification","paper:lemma:isotopy-cutting ≃ paper:lemma:surface-transverse","paper:thm:self-gluing-hh0 ≃ paper:theorem:self-gluing-hh","paper:thm:capping-off-neighborhood ≃ paper:theorem:self-gluing-closed，并由 paper:calculation:self-gluing-equivalence 补足关系定义","paper:cor:trisection-presentation ≃ paper:theorem:trisection-corollary","paper:thm:2d-gluing-3mfld ≃ paper:theorem:surface-gluing"],"matchedInferences":["paper:proof:self-gluing-eval ≃ paper:inference:proof:4","paper:proof:isotopy-cutting ≃ paper:inference:proof:10","paper:proof:gluing-isomorphism-eval ≃ paper:inference:proof:1，且候选 proof:9 补充逆映射和关系相容性","paper:proof:gluing-bimodules ≃ paper:inference:proof:2","paper:proof:self-gluing-hh0 ≃ paper:inference:proof:5","paper:proof:capping-off-neighborhood ≃ paper:inference:proof:6","paper:proof:2d-gluing-3mfld ≃ paper:inference:proof:8"],"missingEntries":["paper:b0:mww-skein-lasagna：候选提取了 lasagna filling/module 定义，但其 MWW B₀ 条目没有覆盖 Gold 所述普遍 Skein Lasagna 模基础及柱面配边映射相容性。","paper:b0:gay-kirby-trisection-existence：候选包含三截面定义和图，但遗漏 Gay–Kirby 的三截面存在与稳定唯一性外部背景，且 B₀ 列表未引用该结果。"],"missingInferences":["paper:proof:trisection-presentation 中以 paper:def:trisection-diagram 和 paper:b0:gay-kirby-trisection-existence 确立三截面框架的前提角色未被候选保留；候选还以不必要的闭流形填补定理替代了这部分逻辑。"],"promptVersion":"sol-score-prompt-v2","schema":"cmath.paper-import-sol-score/v2","scorer":"gpt-5.6-sol","solScore":91,"summary":"候选 JSON 与 Project View 可解析，mainTarget 及全部 inference 引用有效；它准确覆盖了带角双模、张量积粘合、自粘合 HH_0、中心曲面填补、三截面组装和二维曲面粘合等几乎全部核心数学内容，证明方向也总体正确。主要缺陷是 B₀ 组织不完整：遗漏 Gay–Kirby 背景，MWW 条目陈述过弱，并将 Banyaga fragmentation 重复且部分内生化；三截面推理还错误加入了闭流形填补定理。整体已属成熟提取，但外部基础角色和少数证明依赖仍需校正。","verdict":"mature"}