{"candidateArtifact":"benchmarks/paper-import/experiments/luna-paper-import-off-compact-v1/yasui-prompt-v2-run-1.json","caseId":"yasui-2019-geometrically-simply-connected-4-manifolds","entries":{"completeness":16,"correctness":21,"score":37},"format":{"jsonValidity":4,"referenceIntegrity":6,"score":10},"goldRevision":"v1","incorrectEntries":["paper:def:2-handle-neighborhood-class：候选定义要求该类是 H_2(W;Z)≅Z 的生成元之像，比 Gold 的“可由 W 内的 2-循环代表”更强，遗漏生成元倍数所表示的类。","paper:b0:taubes-symplectic-sw：候选条目声称辛流形及其反向定向均满足相应 Taubes 条件；正确用途应是对每个实际承认辛结构的定向分别应用 Taubes 定理。","paper:corollary:handle-class-sw-vanishing：候选只陈述普通 SW 消失并附加无辛结论，不能替代 Gold 的 paper:thm:positive-definite-vanishing（稳定同伦 SW 消失）。","paper:theorem:non-symplectic-orientation-reversal：重复条目把 Gold 条件 b_2^-(X)≢1 mod 4 错写成 b_2(X)≢1 mod 4。","paper:corollary:cp2-characterization：候选给出的推导称“非辛性推出 b_2^+=b_2=1”，该逻辑并不由所列 premises 成立，且公式中含异常的 U+0000 字符。"],"incorrectInferences":["paper:inference:proof:2：结论虽是主定理，但 premises 仅列 2-把手邻域定义；statement 实际调用了候选中不存在的“二柄类稳定不变量消失定理”，又没有引用几何单连通同调引理，证明链不闭合。","paper:inference:proof:7：意图对应几何单连通定向辛阻碍，但 premises 用定义代替了 paper:lemma:homology-classes-handle-neighborhoods；statement 所需的“几何单连通推出存在适当二柄类”没有由所列 premises 支撑。","paper:inference:proof:8：结论包含二柄类条件下普通 SW 消失和无辛性，但 premises 只有“普通 SW 非零推出稳定不变量非零”和 Taubes 非消失，缺少作为起点的二柄类稳定不变量消失结论。","paper:inference:proof:5：从无辛性与 b_2=1 的把手刻画直接推出 CP^2 刻画的论证方向不完整；尤其“非辛性推出 b_2^+=b_2=1”不成立。"],"inferences":{"completeness":12,"correctness":17,"score":29},"matchedEntries":["paper:thm:geom-simply-connected-pos-definite（候选主目标 paper:theorem:stable-cohomotopy-sw-vanishing）","paper:b0:bauer-connected-sum-nonvanishing（由候选 Bauer 两个近重复条目覆盖）","paper:b0:froyshov-vanishing-theorem","paper:b0:taubes-symplectic-sw（核心的模 2 非消失用途基本覆盖）","paper:b0:symplectic-betti-parity","paper:lemma:embedded-sphere-double（候选 paper:lemma:zero-self-intersection-sphere）","paper:thm:sphere-obstruction-nonvanishing（候选 paper:theorem:adjunction-inequality-stable-cohomotopy）","paper:thm:orientation-symplectic-obstruction（候选 paper:theorem:one-orientation-no-symplectic）","paper:lemma:geom-simply-connected-homology","paper:thm:geom-simply-connected-symplectic-obstruction（候选 paper:theorem:opposite-orientation-no-symplectic）"],"matchedInferences":["paper:proof:sphere-obstruction-nonvanishing（候选 paper:inference:proof:1）","paper:proof:orientation-symplectic-obstruction（候选 paper:inference:proof:6；proof:9 是有条件笔误的重复版本）","paper:proof:geom-simply-connected-homology（候选 paper:inference:proof:10）","paper:proof:geom-simply-connected-pos-definite（候选 proof:2 的结论与文字思路部分匹配，但引用链不完整）","paper:proof:geom-simply-connected-symplectic-obstruction（候选 proof:7 的结论与文字思路部分匹配，但缺少同调引理 premise）"],"missingEntries":["paper:def:geometrically-simply-connected","paper:def:bauer-furuta-invariant","paper:def:symplectic-structure-4mfld","paper:thm:positive-definite-vanishing（具二柄邻域表示的非挠类时，正定流形的稳定同伦 SW 消失）"],"missingInferences":["paper:proof:embedded-sphere-double：候选没有给出把手滑移至 K#bar(K)、再封口得到零自交嵌入球面的证明。","paper:proof:positive-definite-vanishing：候选缺失从 Bauer 连通和非消失、双倍流形零自交球面及球面阻碍推出二柄类稳定同伦 SW 消失的关键中间证明。"],"promptVersion":"sol-score-prompt-v2","schema":"cmath.paper-import-sol-score/v2","scorer":"gpt-5.6-sol","solScore":76,"summary":"候选 JSON 与 Project View 可解析，ID 引用也基本完整；它正确抓住主消失定理、Bauer/Frøyshov/Taubes/Betti 奇偶性背景、零自交球面、球面阻碍、定向辛阻碍和几何单连通同调引理。主要缺陷是遗漏核心中间定理“二柄类正定流形的稳定同伦 SW 消失”及其证明，并完全缺少零自交球面引理的把手证明；主定理和最终辛阻碍的 inference 因而依赖未列出的结果或缺少必要 premise。此外，二柄邻域定义过强，若干重复条目带有条件笔误或不成立的额外推导。","verdict":"needs-revision"}