{"candidateArtifact":"benchmarks/model-outputs/fixed-1.0/cornered-skein-lasagna-theory-v3.13-20260818T032656Z.json","caseId":"cornered-skein-lasagna-theory","entries":{"completeness":13,"correctness":23,"score":36},"format":{"jsonValidity":4,"referenceIntegrity":5,"score":9},"goldRevision":"v1","incorrectEntries":["候选的 paper:definition:zeroth-hochschild-homology 对分次的表述出现“分次 Z2-分次”的混杂，未清楚保持 Gold 中的分次结构","paper:external:fragmentation-lemma 与 ext:fragmentation-lemma 重复表示同一外部引理，后者未纳入 B₀ 或推理闭包，造成冗余和轻微结构不一致"],"incorrectInferences":[],"inferences":{"completeness":7,"correctness":23,"score":30},"matchedEntries":["paper:def:cornered-3mfld-category ≃ paper:definition:three-manifold-category","paper:def:cornered-4mfld-bimodule ≃ paper:definition:cornered-bimodule","paper:def:bimodule-tensor-product ≃ paper:definition:balanced-tensor-product","paper:def:hochschild-homology ≃ paper:definition:zeroth-hochschild-homology","paper:def:trisection-diagram ≃ paper:definition:trisection + paper:definition:trisection-diagram","paper:def:surface-bicategory ≃ paper:definition:surface-bicategory","paper:b0:rw-gluing-map ≃ paper:proposition:external-rw24","paper:b0:banyaga-fragmentation ≃ paper:external:fragmentation-lemma","paper:lemma:gluing-isomorphism-eval ≃ paper:lemma:gluing-isomorphism","paper:thm:gluing-bimodules ≃ paper:theorem:gluing"],"matchedInferences":["paper:proof:gluing-isomorphism-eval ≃ paper:inference:proof:1","paper:proof:gluing-bimodules ≃ paper:inference:proof:2"],"missingEntries":["paper:b0:mww-skein-lasagna","paper:b0:gay-kirby-trisection-existence","paper:lemma:self-gluing-eval","paper:lemma:isotopy-cutting","paper:thm:self-gluing-hh0","paper:thm:capping-off-neighborhood","paper:cor:trisection-presentation","paper:thm:2d-gluing-3mfld"],"missingInferences":["paper:proof:self-gluing-eval","paper:proof:isotopy-cutting","paper:proof:self-gluing-hh0","paper:proof:capping-off-neighborhood","paper:proof:trisection-presentation","paper:proof:2d-gluing-3mfld"],"promptVersion":"sol-score-prompt-v2","schema":"cmath.paper-import-sol-score/v2","scorer":"gpt-5.6-sol","solScore":75,"summary":"候选准确提取了带边三维流形范畴、带角四维流形双模、平衡张量积及核心张量积粘合定理，并正确保留了该定理的两级证明链；mainTarget 也与 Gold 等价，现存引用基本有效。但候选在可达闭包处理中删掉了自粘合—Hochschild 同调、填补中心曲面邻域、三截面表示以及二维扩张三流形粘合这一整组后续核心结论和证明，只覆盖了 Gold 的前段粘合逻辑；同时缺少 MWW 与 Gay–Kirby 两项 B₀，且存在 fragmentation lemma 重复项和一处分次表述混杂。因此数学正确性尚好，但完整性明显不足。","verdict":"needs-revision"}