{"candidateArtifact":"benchmarks/model-outputs/fixed-1.0/yasui-2019-geometrically-simply-connected-4-manifolds-v3.20-20260818T071447Z.json","caseId":"yasui-2019-geometrically-simply-connected-4-manifolds","entries":{"completeness":19,"correctness":21,"score":40},"format":{"jsonValidity":4,"referenceIntegrity":6,"score":10},"goldRevision":"v1","incorrectEntries":["候选 paper:theorem:generalized-symplectic 将 Gold paper:thm:orientation-symplectic-obstruction 的条件 b_2^-(X)\\not\\equiv1\\pmod4 错写为 b_2(X)\\not\\equiv1\\pmod4。","候选 paper:corollary:two-orientation 同样将 Gold paper:thm:geom-simply-connected-symplectic-obstruction 的 b_2^-(X) 条件错写为 b_2(X)，因此所得双定向辛阻碍陈述不等价于 Gold。","候选 paper:theorem:sw-refinement 的 statement 正确表达“普通 SW 非零蕴含稳定不变量非零”，但 title 反向写成“稳定不变量非零蕴含普通不变量非零”，形成内部矛盾。","候选 paper:theorem:3.2 实际陈述两个开放问题，却被标为 theorem；这是错误的数学角色分类。","候选 paper:external:handle-b2 声称“二阶同调由 2-把手生成，因此存在单个 2-把手表示的非挠类”，把需要把手滑移等论证的结论写成直接推论，论证角色和强度不可靠。"],"incorrectInferences":["候选 paper:inference:proof:5 对应 Gold paper:proof:orientation-symplectic-obstruction，但其结论 Entry 使用了错误的 b_2(X) 模 4 条件，不能完整推出 Gold 的定理。","候选 paper:inference:proof:10 对应 Gold paper:proof:geom-simply-connected-pos-definite，但没有使用候选已提取的 paper:lemma:all-classes，而依赖论证不足的 paper:external:handle-b2；主结论正确，但前提链弱于 Gold。","候选 paper:inference:proof:9 对应 Gold paper:proof:geom-simply-connected-symplectic-obstruction，但 premises 仅列推广辛阻碍定理，遗漏几何单连通定义及二阶同调类由 2-把手邻域表示的关键桥梁，而且其 conclusion 带有错误的 b_2(X) 条件。","候选 paper:inference:proof:11 从 paper:external:handle-b2 直接得出 paper:theorem:generalized-symplectic；该前提至多提供某个 2-把手类，不能单独推出完整的双定向辛阻碍定理。","候选 paper:inference:proof:4 的陈述还推出“无辛结构”，但 premises 未列 Taubes 辛流形 SW 非消失结果，所列前提只足以推出普通 SW 不变量消失。"],"inferences":{"completeness":18,"correctness":20,"score":38},"matchedEntries":["paper:def:geometrically-simply-connected","paper:def:2-handle-neighborhood-class","paper:def:bauer-furuta-invariant（由候选 refinement 条目实质覆盖）","paper:b0:bauer-connected-sum-nonvanishing","paper:b0:froyshov-vanishing-theorem","paper:b0:taubes-symplectic-sw","paper:b0:symplectic-betti-parity","paper:lemma:embedded-sphere-double","paper:thm:sphere-obstruction-nonvanishing","paper:thm:positive-definite-vanishing","paper:lemma:geom-simply-connected-homology","paper:thm:geom-simply-connected-pos-definite"],"matchedInferences":["paper:proof:embedded-sphere-double","paper:proof:sphere-obstruction-nonvanishing","paper:proof:positive-definite-vanishing","paper:proof:geom-simply-connected-homology"],"missingEntries":["paper:def:symplectic-structure-4mfld（辛结构和典范 spin^c 结构的定义未被独立、完整提取）"],"missingInferences":[],"promptVersion":"sol-score-prompt-v2","schema":"cmath.paper-import-sol-score/v2","scorer":"gpt-5.6-sol","solScore":88,"summary":"候选 JSON 与 Project View 可解析，所有主目标、B₀ 和 inference 引用均有效。候选覆盖了主定理、四项核心外部结果，以及从 2-把手邻域构造零自交球面并结合 Bauer 与 Frøyshov 得到矛盾的主要证明链，整体完整度很高。主要缺陷是两项双定向辛阻碍把关键条件 b_2^- 错写成 b_2，部分 inference 的显式 premises 不足或依赖论证过强的 handle-b2 条目；此外存在标题与陈述方向矛盾、把开放问题标为定理等角色错误。","verdict":"promising"}