{"candidateArtifact":"benchmarks/model-outputs/fixed-1.0/knot-hopf-rt-v3.26-20260818T095734Z.json","caseId":"knot-hopf-rt","entries":{"completeness":17,"correctness":21,"score":38},"format":{"jsonValidity":4,"referenceIntegrity":6,"score":10},"goldRevision":"v1","incorrectEntries":["paper:def:negligible-module：把“所有 endomorphism 的 quantum trace 均为零”误称为等价于仅有 tr_q(id_Z)=0；后者一般不足以推出前者。","B₀ 角色分类过宽：候选把 unit-braiding、Rep_fd(A) ribbon proposition、handle-slide lemma 等派生结果也列入 B₀；不过 Gold 的四个外部基础结果均有候选等价项。","paper:definition:colored-link-invariant：数学内容基本正确，但被标为 fact/definition，弱化了 Gold 中“由 Turaev functor 得到 ribbon-isotopy invariant”的 proposition 角色。"],"incorrectInferences":["paper:inference:organization:3：从 coproduct 给出的 tensor-product module structure 直接推出 antipode 给出的 dual-module structure，premise 不足且逻辑组织方向不当；二者应分别由 Hopf algebra 的 coproduct 与 antipode 导出。"],"inferences":{"completeness":3,"correctness":18,"score":21},"matchedEntries":["rt:entry:framed-link","rt:entry:surgery-manifold（由 paper:def:WL 与 paper:def:ML 合并覆盖）","rt:entry:lickorish-wallace","rt:entry:kirby-calculus","rt:entry:monoidal-category","rt:entry:braiding","rt:entry:duality","rt:entry:ribbon-category","rt:entry:graphical-calculus","rt:entry:turaev-ribbon-graph-functor","rt:entry:colored-link-invariant","rt:entry:quasitriangular-hopf-algebra","rt:entry:ribbon-hopf-algebra","rt:entry:coproduct-monoidal","rt:entry:antipode-duality","rt:entry:r-matrix-braiding","rt:entry:universal-twist（由 ribbon-representation proposition 中的 universal twist 内容覆盖）","rt:entry:rep-ribbon","rt:entry:quantum-trace","rt:entry:finite-simple-system、rt:entry:hopf-link-matrix 与 rt:entry:modular-category（由候选的综合 modular-category 定义覆盖）","rt:entry:negligible-module（核心定义匹配，但附带错误等价陈述）","rt:entry:modular-hopf-algebra","rt:entry:turaev-purification-theorem","rt:entry:purified-category-modular","rt:entry:modular-data","rt:entry:kirby-color（由 Kirby-color 与 Kirby-sum 两项合并覆盖）","rt:entry:handle-slide-invariance","rt:entry:signature-normalization","rt:entry:blowup-invariance、rt:entry:kirby-presentation-independence 与 rt:entry:rt-invariant（由 paper:theorem:6.3 的综合陈述覆盖）"],"matchedInferences":["rt:inference:hopf-to-duality：候选 paper:inference:proof:4 正确验证 antipode duality 中 evaluation 与 coevaluation 的 A-linearity，覆盖该推理的主要内容。"],"missingEntries":["rt:entry:kirby-reduction","rt:entry:hopf-algebra","rt:entry:twist（候选在 ribbon-category 综合定义中使用了 twist，但没有可独立承担该 Gold 定义角色的 Entry）","rt:entry:purification"],"missingInferences":["rt:inference:geometry-to-kirby-reduction","rt:inference:organize-ribbon-category","rt:inference:organize-graphical-calculus","rt:inference:graphical-calculus-to-link-invariant","rt:inference:hopf-to-monoidal","rt:inference:r-matrix-to-braiding","rt:inference:ribbon-element-to-twist","rt:inference:assemble-rep-ribbon","rt:inference:rep-ribbon-to-qtrace","rt:inference:organize-modular-category","rt:inference:apply-purification-theorem","rt:inference:organize-modular-data","rt:inference:organize-kirby-color","rt:inference:kirby-color-to-slide","rt:inference:organize-signature-normalization","rt:inference:normalization-cancels-blowup","rt:inference:kirby-moves-to-presentation-independence","rt:inference:presentation-independence-to-rt"],"promptVersion":"sol-score-prompt-v2","schema":"cmath.paper-import-sol-score/v2","scorer":"gpt-5.6-sol","solScore":69,"summary":"候选 JSON 与 Project View 可解析，ID 引用完整，mainTarget 正确；Entry 覆盖面较高，尤其完整提取了 ribbon/Hopf、modular data、Kirby color、归一化及最终 RT 定理。主要 Entry 缺口是 Kirby 约化、Hopf algebra、独立 twist 与 purification，并且 negligible module 含有错误的等价表述，B₀ 也明显过宽。最严重的问题是 inference：候选仅有 4 条局部关系，只有 Hopf duality 的验证实质匹配 Gold，几乎完全遗漏从 surgery/Kirby 约化、ribbon Hopf 表示结构、purification、Kirby-color 不变性与归一化直至 RT 不变量的主要证明和组织链。格式得分为 10/10。","verdict":"needs-revision"}