{"candidateArtifact":"benchmarks/model-outputs/fixed-1.0/hopf-degree-theorem-v3.13-20260818T031128Z.json","caseId":"hopf-degree-theorem","entries":{"completeness":14,"correctness":21,"score":35},"format":{"jsonValidity":4,"referenceIntegrity":5,"score":9},"goldRevision":"v1","incorrectEntries":["candidate paper:def:winding-number：把方向映射的值域固定写成 S^1；一般维数中应为相应的单位球面 S^{k-1}，因此该定义只在低维特例下准确。","candidate paper:theorem:inductive-degree-zero：名为 degree-zero 归纳定理，但陈述仅构造了局部坐标下以 0 为正则值的映射，没有陈述归纳步骤最终得到的零伦结论；其内容不足以支撑后续 inference。","candidate paper:theorem:extension-sphere 与 Gold paper:thm:extension 并不完全等价：候选给出一般带边界流形到 S^k 的延拓判据，而 Gold 的指定条目陈述 S^k 边界映射到 D^{k+1} 的延拓判据。候选的条目更接近 Gold paper:lemma:extend-rk1。"],"incorrectInferences":["candidate paper:inference:proof:3：把 Isotopy Lemma 列为边界零伦映射光滑延拓的 premise，但其论证实际依赖给定零伦与 bump-function 光滑化；该 premise 的数学作用不清楚。","candidate paper:inference:proof:6 → paper:theorem:inductive-degree-zero：argument 声称完成去零、投影回球面并构造同伦，但 conclusion 条目的陈述只到“0 是正则值”，premises 与所引用 conclusion 的实际陈述不闭合。","candidate paper:inference:proof:9：总体对应 Gold 的延拓论证，但候选将一般 W→S^k 的延拓判据作为结论，未清楚保留 Gold paper:thm:extension 所指定的 D^{k+1} 值域版本。"],"inferences":{"completeness":13,"correctness":21,"score":34},"matchedEntries":["paper:def:degree","paper:def:winding（除候选将值域误写为固定 S^1 外）","paper:def:stereo","paper:def:bump","paper:b0:isotopy","paper:b0:linear-isotopy","paper:b0:sard","paper:b0:transversality-extension","paper:b0:epsilon-nbhd","paper:b0:poincare-hopf","paper:lemma:regular-winding","paper:lemma:winding-sum","paper:lemma:boundary-extension","paper:lemma:base-s1（候选覆盖其 degree-zero 核心基例）","paper:lemma:punctured-euclidean","paper:lemma:remove-origin","paper:thm:degree-zero-null","paper:lemma:extend-rk1","paper:thm:hopf","paper:calc:euler-sphere（球面部分）"],"matchedInferences":["paper:proof:regular-winding","paper:proof:winding-sum","paper:proof:boundary-extension","paper:proof:base-s1","paper:proof:punctured-euclidean","paper:proof:remove-origin","paper:proof:degree-zero-null（由候选 proofs 6–7 合并覆盖，但中间 conclusion 陈述不完整）","paper:proof:extend-rk1","paper:proof:extension（总体证明路线被覆盖，但结论版本存在偏差）","paper:proof:hopf"],"missingEntries":["paper:def:vf-index","paper:b0:transversality-homotopy","paper:thm:extension 的指定 D^{k+1}→D^{k+1} 版本","paper:cor:homotopy-group","paper:lemma:vf-index-zero","paper:lemma:vf-finite-zeros","paper:lemma:vf-localize","paper:thm:vf-euler","paper:cor:hairy-ball","paper:calc:euler-sphere 中 χ(T^n)=0 的环面计算"],"missingInferences":["paper:proof:homotopy-group","paper:proof:vf-index-zero","paper:proof:vf-finite-zeros","paper:proof:vf-localize","paper:proof:vf-euler","paper:proof:hairy-ball"],"promptVersion":"sol-score-prompt-v2","schema":"cmath.paper-import-sol-score/v2","scorer":"gpt-5.6-sol","solScore":78,"summary":"候选 JSON 与 Project View 均可解析，mainTarget 和现存 Entry/inference 引用基本有效；它较完整地重建了映射度、局部绕数、去除原点、degree-zero 零伦、延拓以及 Hopf 度定理的主要证明链。主要缺陷是几乎整段遗漏了 Gold 中从向量场指标、横截微扰和 Poincaré–Hopf 到 χ=0 判据及毛球定理的应用链，也遗漏 π_k(S^k)≅Z；此外一般维数绕数的值域写错，归纳步骤的 conclusion 陈述不完整，并且延拓定理版本与 Gold 不完全一致。格式部分为 9/10，Entry 为 35/45，Inference 为 34/45。","verdict":"needs-revision"}